{
  "state": "verified",
  "verdict": "transaction reached verified",
  "envelope_result": {
    "status": "satisfied",
    "satisfied": [
      "require[0] fact='wmifilter.container.present'",
      "require[1] fact='wmifilter.target.present'",
      "require[2] fact='wmifilter.target.match_count'",
      "require[3] fact='wmifilter.target.name'",
      "require[4] fact='wmifilter.target.parm1'",
      "require[5] fact='wmifilter.target.parm2'",
      "require[6] fact='wmifilter.target.id'",
      "derive[0]",
      "forbid[0] scope='wmifilter.container.other_names'",
      "forbid[1] scope='wmifilter.container.unnamed_count'"
    ],
    "violated": [],
    "unresolved": [],
    "unclassified": [],
    "characterization": "satisfied: 10 clause(s) held; 7 delta entries all covered\n  covered changed: wmifilter.container.object_count (category 'structural')\n  covered changed: wmifilter.target.id (category 'identity')\n  covered changed: wmifilter.target.match_count (category 'structural')\n  covered changed: wmifilter.target.name (category 'content')\n  covered changed: wmifilter.target.parm1 (category 'content')\n  covered changed: wmifilter.target.parm2 (category 'content')\n  covered changed: wmifilter.target.present (category 'co",
    "delta": [
      {
        "key": "wmifilter.container.object_count",
        "kind": "changed",
        "before": 0,
        "after": 1
      },
      {
        "key": "wmifilter.target.id",
        "kind": "changed",
        "before": "",
        "after": "{FBD2D6DA-B455-42C1-B30D-3255249738B9}"
      },
      {
        "key": "wmifilter.target.match_count",
        "kind": "changed",
        "before": 0,
        "after": 1
      },
      {
        "key": "wmifilter.target.name",
        "kind": "changed",
        "before": "",
        "after": "zz-wcd-wmi-w7"
      },
      {
        "key": "wmifilter.target.parm1",
        "kind": "changed",
        "before": "",
        "after": "zz wcd window seven filter"
      },
      {
        "key": "wmifilter.target.parm2",
        "kind": "changed",
        "before": "",
        "after": "1;3;10;35;WQL;root\\CIMv2;SELECT * FROM Win32_OperatingSystem;"
      },
      {
        "key": "wmifilter.target.present",
        "kind": "changed",
        "before": false,
        "after": true
      }
    ]
  },
  "events": [
    {
      "sequence": 1,
      "from_state": null,
      "to_state": "prepared",
      "reason": "capability gpmc.author_wmi_filter prepared over GPO None"
    },
    {
      "sequence": 2,
      "from_state": "prepared",
      "to_state": "armed",
      "reason": "capability gpmc.author_wmi_filter invocation started"
    },
    {
      "sequence": 3,
      "from_state": "armed",
      "to_state": "commit_attempted",
      "reason": "run-sheet crosses 'ok_wmi_query_dialog' (profile class 'potentially_mutating')"
    },
    {
      "sequence": 4,
      "from_state": "commit_attempted",
      "to_state": "verified",
      "reason": "converged after 2 polls, 2 reproductions"
    }
  ],
  "provenance": {
    "$schema": "docs/transaction-record-schema-v1.json",
    "schema_version": 1,
    "capability": "gpmc.author_wmi_filter",
    "run_sheet": "gpmc.author_wmi_filter",
    "transaction_id": "842d087e-b11a-4de9-88c8-1963dc27cb5e",
    "console": {
      "mode": "controller_direct",
      "state": "unlocked",
      "helper_responds": true
    },
    "steps": [
      [
        {
          "index": 0,
          "step": "wait_foreground[open_gpmc_console]",
          "ok": true,
          "detail": {
            "matched": true,
            "title": "Group Policy Management",
            "surfaced": true
          }
        },
        {
          "index": 1,
          "step": "context[navigate_tree]",
          "ok": true,
          "detail": {
            "foreground": {
              "class": "ConsoleWindowClass",
              "process_name": "powershell",
              "pid": 3380,
              "uia_digest": "9193a3dfa818177116222e6726568faf1e459eb031086f91eface84216a650ea",
              "rect": {
                "left": 0,
                "bottom": 720,
                "top": 0,
                "right": 1024,
                "height": 720,
                "width": 1024
              },
              "title": "Administrator: C:\\WINDOWS\\System32\\WindowsPowerShell\\v1.0\\powershell.exe",
              "hwnd": 786546
            },
            "asserted_window": "Group Policy Management"
          }
        },
        {
          "index": 2,
          "step": "shot",
          "ok": true,
          "detail": {
            "saved": "C:\\projects\\windows-console-driver\\runs\\w7-gpmc-open.png"
          }
        },
        {
          "index": 3,
          "step": "click_element[navigate_tree]",
          "ok": true,
          "detail": {
            "clicked": [
              101,
              294
            ]
          }
        },
        {
          "index": 4,
          "step": "key[navigate_tree]",
          "ok": true,
          "detail": {
            "injected_events": 16
          }
        },
        {
          "index": 5,
          "step": "shot",
          "ok": true,
          "detail": {
            "saved": "C:\\projects\\windows-console-driver\\runs\\w7-wmi-node.png"
          }
        },
        {
          "index": 6,
          "step": "key[open_new_wmi_filter_dialog]",
          "ok": true,
          "detail": {
            "injected_events": 8
          }
        },
        {
          "index": 7,
          "step": "shot",
          "ok": true,
          "detail": {
            "saved": "C:\\projects\\windows-console-driver\\runs\\w7-menu-opened.png"
          }
        },
        {
          "index": 8,
          "step": "wait_foreground[open_new_wmi_filter_dialog]",
          "ok": true,
          "detail": {
            "matched": true,
            "title": "New WMI Filter",
            "surfaced": true
          }
        },
        {
          "index": 9,
          "step": "shot",
          "ok": true,
          "detail": {
            "saved": "C:\\projects\\windows-console-driver\\runs\\w7-new-filter-dialog.png"
          }
        },
        {
          "index": 10,
          "step": "type_text[open_new_wmi_filter_dialog]",
          "ok": true,
          "detail": {
            "typed": 13
          }
        },
        {
          "index": 11,
          "step": "key[open_new_wmi_filter_dialog]",
          "ok": true,
          "detail": {
            "injected_events": 2
          }
        },
        {
          "index": 12,
          "step": "type_text[open_new_wmi_filter_dialog]",
          "ok": true,
          "detail": {
            "typed": 26
          }
        },
        {
          "index": 13,
          "step": "click_element[add_wmi_query]",
          "ok": true,
          "detail": {
            "clicked": [
              429,
              167
            ]
          }
        },
        {
          "index": 14,
          "step": "wait_foreground[add_wmi_query]",
          "ok": true,
          "detail": {
            "matched": true,
            "title": "WMI Query",
            "surfaced": true
          }
        },
        {
          "index": 15,
          "step": "shot",
          "ok": true,
          "detail": {
            "saved": "C:\\projects\\windows-console-driver\\runs\\w7-query-dialog.png"
          }
        },
        {
          "index": 16,
          "step": "type_text[add_wmi_query]",
          "ok": true,
          "detail": {
            "typed": 35
          }
        },
        {
          "index": 17,
          "step": "shot",
          "ok": true,
          "detail": {
            "saved": "C:\\projects\\windows-console-driver\\runs\\w7-query-typed.png"
          }
        },
        {
          "index": 18,
          "step": "click_element[ok_wmi_query_dialog]",
          "ok": true,
          "detail": {
            "clicked": [
              261,
              257
            ]
          }
        },
        {
          "index": 19,
          "step": "click_element[ok_new_wmi_filter_dialog]",
          "ok": true,
          "detail": {
            "clicked": [
              339,
              323
            ]
          }
        }
      ]
    ],
    "cleanup": {
      "ran": true,
      "journal": [
        {
          "index": 0,
          "step": "guest",
          "ok": true,
          "detail": [
            {
              "index": 0,
              "step": "guest",
              "ok": true,
              "detail": {
                "stdout": "remaining=0"
              }
            }
          ]
        },
        {
          "index": 1,
          "step": "guest",
          "ok": true,
          "detail": [
            {
              "index": 0,
              "step": "guest",
              "ok": true,
              "detail": {
                "stdout": "removed=zz-wcd-wmi-w7"
              }
            }
          ]
        },
        {
          "index": 2,
          "step": "guest",
          "ok": true,
          "detail": [
            {
              "index": 0,
              "step": "guest",
              "ok": true,
              "detail": {
                "stdout": "unregistered=WCDLaunchGPMC"
              }
            }
          ]
        }
      ]
    },
    "notes": [
      "interactive session lease held: wcd.console:192.168.1.23:LabMS01",
      "recovery checkpoint 'estate-current-20260905' present: True"
    ]
  }
}
